{
  "format": "qusx-surah-alignment-review",
  "version": "1.0.0",
  "status": "complete-candidate-inventory-printed-edition-verified",
  "surah": 63,
  "canonicalTradition": "hafs-kufi",
  "traditions": [
    "hafs-kufi",
    "shubah-kfqc",
    "warsh-kfqc",
    "qalon-kfqc",
    "douri-kfqc",
    "sousi-kfqc"
  ],
  "generatedFrom": [
    "../alignments/douri-to-hafs.candidates.json",
    "../alignments/qalon-to-hafs.candidates.json",
    "../alignments/shubah-to-hafs.candidates.json",
    "../alignments/sousi-to-hafs.candidates.json",
    "../alignments/warsh-to-hafs.candidates.json"
  ],
  "completeness": {
    "candidateObservations": 8,
    "uniqueReviewLocations": 4,
    "reviewed": 4,
    "pending": 0
  },
  "allowedDecisions": [
    "reading-variant",
    "orthography-presentation",
    "tokenization",
    "source-versification",
    "reject-candidate"
  ],
  "records": [
    {
      "id": "qusx:review:063:001",
      "canonical": "63:6:16",
      "hafs": {
        "location": "63:6:16",
        "text": "يَهْدِى"
      },
      "observations": [
        {
          "tradition": "qalon-kfqc",
          "type": "uncertain-match",
          "confidence": "review-required",
          "reading": {
            "location": "63:6:16:qalon",
            "text": "يَهْدِے"
          },
          "context": [
            {
              "hafs": {
                "location": "63:6:12",
                "text": "لَهُمْ ۚ"
              },
              "qalon": {
                "location": "63:6:12:qalon",
                "text": "لَهُمْۖ"
              }
            },
            {
              "hafs": {
                "location": "63:6:13",
                "text": "إِنَّ"
              },
              "qalon": {
                "location": "63:6:13:qalon",
                "text": "إِنَّ"
              }
            },
            {
              "hafs": {
                "location": "63:6:14",
                "text": "ٱللَّهَ"
              },
              "qalon": {
                "location": "63:6:14:qalon",
                "text": "اَ۬للَّهَ"
              }
            },
            {
              "hafs": {
                "location": "63:6:15",
                "text": "لَا"
              },
              "qalon": {
                "location": "63:6:15:qalon",
                "text": "لَا"
              }
            },
            {
              "hafs": {
                "location": "63:6:16",
                "text": "يَهْدِى"
              },
              "qalon": {
                "location": "63:6:16:qalon",
                "text": "يَهْدِے"
              }
            },
            {
              "hafs": {
                "location": "63:6:17",
                "text": "ٱلْقَوْمَ"
              },
              "qalon": {
                "location": "63:6:17:qalon",
                "text": "اِ۬لْقَوْمَ"
              }
            },
            {
              "hafs": {
                "location": "63:6:18",
                "text": "ٱلْفَـٰسِقِينَ"
              },
              "qalon": {
                "location": "63:6:18:qalon",
                "text": "اَ۬لْفَٰسِقِينَۖ"
              }
            },
            {
              "hafs": {
                "location": "63:7:1",
                "text": "هُمُ"
              },
              "qalon": {
                "location": "63:7:1:qalon",
                "text": "هُمُ"
              }
            },
            {
              "hafs": {
                "location": "63:7:2",
                "text": "ٱلَّذِينَ"
              },
              "qalon": {
                "location": "63:7:2:qalon",
                "text": "اُ۬لذِينَ"
              }
            }
          ]
        },
        {
          "tradition": "warsh-kfqc",
          "type": "uncertain-match",
          "confidence": "review-required",
          "reading": {
            "location": "63:6:16:warsh",
            "text": "يَهْدِے"
          },
          "context": [
            {
              "hafs": {
                "location": "63:6:12",
                "text": "لَهُمْ ۚ"
              },
              "warsh": {
                "location": "63:6:12:warsh",
                "text": "لَهُمُۥٓۖ"
              }
            },
            {
              "hafs": {
                "location": "63:6:13",
                "text": "إِنَّ"
              },
              "warsh": {
                "location": "63:6:13:warsh",
                "text": "إِنَّ"
              }
            },
            {
              "hafs": {
                "location": "63:6:14",
                "text": "ٱللَّهَ"
              },
              "warsh": {
                "location": "63:6:14:warsh",
                "text": "اَ۬للَّهَ"
              }
            },
            {
              "hafs": {
                "location": "63:6:15",
                "text": "لَا"
              },
              "warsh": {
                "location": "63:6:15:warsh",
                "text": "لَا"
              }
            },
            {
              "hafs": {
                "location": "63:6:16",
                "text": "يَهْدِى"
              },
              "warsh": {
                "location": "63:6:16:warsh",
                "text": "يَهْدِے"
              }
            },
            {
              "hafs": {
                "location": "63:6:17",
                "text": "ٱلْقَوْمَ"
              },
              "warsh": {
                "location": "63:6:17:warsh",
                "text": "اِ۬لْقَوْمَ"
              }
            },
            {
              "hafs": {
                "location": "63:6:18",
                "text": "ٱلْفَـٰسِقِينَ"
              },
              "warsh": {
                "location": "63:6:18:warsh",
                "text": "اَ۬لْفَٰسِقِينَۖ"
              }
            },
            {
              "hafs": {
                "location": "63:7:1",
                "text": "هُمُ"
              },
              "warsh": {
                "location": "63:7:1:warsh",
                "text": "هُمُ"
              }
            },
            {
              "hafs": {
                "location": "63:7:2",
                "text": "ٱلَّذِينَ"
              },
              "warsh": {
                "location": "63:7:2:warsh",
                "text": "اُ۬لذِينَ"
              }
            }
          ]
        }
      ],
      "status": "printed-edition-verified",
      "decision": "orthography-presentation",
      "reviewer": "QUSX printed-edition audit",
      "reviewedAt": "2026-08-11T00:00:00Z",
      "evidence": [
        "https://github.com/dfordev1/usxv2/blob/main/docs/evidence/surah-063/hafs-63-6.png",
        "https://github.com/dfordev1/usxv2/blob/main/docs/evidence/surah-063/warsh-63-6.png",
        "https://github.com/dfordev1/usxv2/blob/main/docs/evidence/surah-063/qalon-63-6.png"
      ],
      "notes": "Page 555, lines 3-4: the final-ya presentation difference is visible in the Hafs, Warsh and Qalun edition files."
    },
    {
      "id": "qusx:review:063:002",
      "canonical": "63:10:14",
      "hafs": {
        "location": "63:10:14",
        "text": "أَخَّرْتَنِىٓ"
      },
      "observations": [
        {
          "tradition": "qalon-kfqc",
          "type": "uncertain-match",
          "confidence": "review-required",
          "reading": {
            "location": "63:10:14:qalon",
            "text": "أَخَّرْتَنِے"
          },
          "context": [
            {
              "hafs": {
                "location": "63:10:10",
                "text": "ٱلْمَوْتُ"
              },
              "qalon": {
                "location": "63:10:10:qalon",
                "text": "اُ۬لْمَوْتُ"
              }
            },
            {
              "hafs": {
                "location": "63:10:11",
                "text": "فَيَقُولَ"
              },
              "qalon": {
                "location": "63:10:11:qalon",
                "text": "فَيَقُولَ"
              }
            },
            {
              "hafs": {
                "location": "63:10:12",
                "text": "رَبِّ"
              },
              "qalon": {
                "location": "63:10:12:qalon",
                "text": "رَبِّ"
              }
            },
            {
              "hafs": {
                "location": "63:10:13",
                "text": "لَوْلَآ"
              },
              "qalon": {
                "location": "63:10:13:qalon",
                "text": "لَوْلَا"
              }
            },
            {
              "hafs": {
                "location": "63:10:14",
                "text": "أَخَّرْتَنِىٓ"
              },
              "qalon": {
                "location": "63:10:14:qalon",
                "text": "أَخَّرْتَنِے"
              }
            },
            {
              "hafs": {
                "location": "63:10:15",
                "text": "إِلَىٰٓ"
              },
              "qalon": {
                "location": "63:10:15:qalon",
                "text": "إِلَىٰ"
              }
            },
            {
              "hafs": {
                "location": "63:10:16",
                "text": "أَجَلٍۢ"
              },
              "qalon": {
                "location": "63:10:16:qalon",
                "text": "أَجَلٖ"
              }
            },
            {
              "hafs": {
                "location": "63:10:17",
                "text": "قَرِيبٍۢ"
              },
              "qalon": {
                "location": "63:10:17:qalon",
                "text": "قَرِيبٖ"
              }
            },
            {
              "hafs": {
                "location": "63:10:18",
                "text": "فَأَصَّدَّقَ"
              },
              "qalon": {
                "location": "63:10:18:qalon",
                "text": "فَأَصَّدَّقَ"
              }
            }
          ]
        },
        {
          "tradition": "warsh-kfqc",
          "type": "uncertain-match",